{"$schema":"https://json-schema.org/draft/2020-12/schema","$id":"novi.knowledge-record/1.0.0","title":"KnowledgeRecord","type":"object","additionalProperties":false,"required":["knowledge_id","subject","predicate","object","validity_interval","evidence_refs","authority_source","confidence","verification_status","privacy_class","revision","provenance"],"properties":{"knowledge_id":{"type":"string"},"subject":{},"predicate":{"type":"string"},"object":{},"validity_interval":{},"evidence_refs":{"type":"array","items":{"type":"string"}},"authority_source":{},"confidence":{},"verification_status":{"type":"string"},"privacy_class":{"type":"string"},"revision":{"type":"integer","minimum":0},"provenance":{}}}